{
 "id": "write-against-the-canonical-piece",
 "title": "Write against the canonical piece",
 "statement": "Make one component canonical and write the rest against it: list what later components may not re-ask, and let none of them contradict it.",
 "example": "One lesson design lists the two questions its film asks and the two words the film defines as off-limits for re-asking.",
 "group": "writing-questions",
 "role": "method",
 "facets": [
  "alignment",
  "integrity",
  "sequence"
 ],
 "stage": "ground",
 "scope": "universal",
 "domains": [
  "g3"
 ],
 "kind": "adopted-rule",
 "status": "held",
 "detail": "The lesson-components spec makes the background film canonical: no later component may contradict it or re-ask its questions. Each lesson design then lists what is off-limits for re-asking, such as the film's sync checks, its stamped definitions and naming the story pattern in the abstract, and a rebuilt lesson keeps the same discipline: glossed words and sync-checked answers are never re-asked. It is the across-components form of telling a writer what an earlier block covers.",
 "against": "none found",
 "evidence": [
  {
   "source": "downloads",
   "path": "5. Curriculum/Instruction/2. Example lesson structure/Example Lesson Components.docx",
   "lines": "7 (textutil text)",
   "quote": "The video is canonical: no later component may contradict it or re-ask its questions.",
   "verified": "script"
  },
  {
   "source": "downloads",
   "path": "5. Curriculum/Instruction/3.1 - Fantasy Classics - Lesson Designs/3.1 - 1. Aladdin and the Wonderful Lamp, Part 1 (FICTION, FIND) — v3 (order + MCQ QA).docx",
   "lines": "28 (textutil text)",
   "quote": "Off-limits for re-asking: the two sync checks above; the sultan and magician stamped definitions; naming or ordering the story pattern in the abstract.",
   "verified": "script"
  },
  {
   "source": "downloads",
   "path": "SUPERSEDED — see v2.1_ WITW Lesson 1 learning walkthrough v2 (table format).md",
   "lines": "32",
   "quote": "Glossed words and sync-checked answers are never re-asked",
   "verified": "script"
  },
  {
   "source": "grade3-reading",
   "path": "_archive/2026-08-13-consolidation/codex-history-extract/HUMAN-g3r-2026-07-27T08-38-36-019fa24b-fb42-7e61-a954-216db3ef77a4.md",
   "lines": "1095",
   "quote": "The video is canonical: no later component may contradict it or re-ask its questions.",
   "verified": "script"
  },
  {
   "source": "grade3-reading-course-renderer",
   "path": "docs/pedagogy/example-lesson-components-2026-08-06.md",
   "lines": "21",
   "quote": "The video is canonical: no later component may contradict it or re-ask its questions.",
   "verified": "script"
  },
  {
   "source": "course-renderer-draft",
   "path": "repo/docs/pedagogy/example-lesson-components-2026-08-06.md",
   "lines": "21",
   "quote": "The video is canonical: no later component may contradict it or re-ask its questions.",
   "verified": "script"
  }
 ],
 "citations": [],
 "found_in": [
  "2026-10-12-4-deep-sweep",
  "2026-10-12-5-full-crawl"
 ],
 "added": "2026-10-12",
 "updated": "2026-10-13"
}
