{
 "id": "practise-the-formats-before-they-count",
 "title": "Practise the formats before they count",
 "statement": "Let learners practise the formats and interactions of the test that counts before it counts, because meeting an unfamiliar interface on the scored test adds noise to the score.",
 "example": "One reading course runs a 43-item practice lane for format exposure that never feeds a mastery gate.",
 "group": "how-people-learn",
 "role": "criterion",
 "facets": [
  "practice",
  "format"
 ],
 "stage": null,
 "scope": "universal",
 "domains": [
  "g3"
 ],
 "kind": "adopted-rule",
 "status": "held",
 "detail": "A reading assessment's position is that learners who practised only single-select items met multi-select and two-part evidence items for the first time on the scored official test, and that interface novelty is construct-irrelevant variance, citing the testing standards (`grade3-reading/ti-courseplans/courses/map-proxy-assessment/validity/00_BRAINLIFT.md`). A Grade 8 reading course runs a 43-item practice lane in three formats for format exposure, never routed through a mastery gate (`incept-package-hub/course-packages/courses/g8-reading/review/evidence/case-for-review.md`).",
 "against": "The package's own audit later bounded the benefit: strongest for the three formats confirmed for the official reading test, low-harm extra practice for the other three (`grade3-reading/ti-courseplans/courses/map-proxy-assessment/validity/00_AUDITS_AND_FIXES.md`). An adversarial review added that if familiarity moves scores at all, it moves the official ones, which matters when the practice doubles as a validation study (`grade3-reading/ti-courseplans/courses/map-proxy-assessment/red-team/RED_TEAM_FINDINGS.md`). Format practice can inflate an internal growth reading, so one course measures growth on a held-out instrument it never teaches to or gates on (`grade3-reading/artifacts/g5_build_2026_07_02/approval_clean.md`).",
 "evidence": [
  {
   "source": "grade3-reading",
   "path": "ti-courseplans/courses/map-proxy-assessment/validity/00_BRAINLIFT.md",
   "lines": "55",
   "quote": "Alpha students practice on 100% MCQ material; their first multi-select or two-part evidence item is on the scored official MAP. Interface novelty is construct-irrelevant variance (AERA/APA/NCME Standard 1.13).",
   "verified": "script"
  },
  {
   "source": "incept-package-hub",
   "path": "course-packages/courses/g8-reading/review/evidence/case-for-review.md",
   "lines": "48-49",
   "quote": "a **43-item non-gating practice lane** (multi_select, hot_text, match) for format exposure, never routed through a mastery gate",
   "verified": "script"
  },
  {
   "source": "grade3-reading",
   "path": "ti-courseplans/courses/map-proxy-assessment/validity/00_AUDITS_AND_FIXES.md",
   "lines": "36",
   "quote": "| 11 | Format-familiarization benefit implied for all six formats | **Bounded** — one-line scope added: strongest for the 3 Reading-2–5-confirmed formats; the other 3 are low-harm additional practice |",
   "verified": "script"
  },
  {
   "source": "grade3-reading",
   "path": "ti-courseplans/courses/map-proxy-assessment/red-team/RED_TEAM_FINDINGS.md",
   "lines": "21",
   "quote": "if familiarity moves scores at all, it moves the official ones.",
   "verified": "script"
  },
  {
   "source": "grade3-reading",
   "path": "artifacts/g5_build_2026_07_02/mapproxy_clean.md",
   "lines": "179",
   "quote": "Interface novelty is construct-irrelevant variance (AERA/APA/NCME Standard 1.13).",
   "verified": "script"
  },
  {
   "source": "grade3-reading",
   "path": "artifacts/PROPOSAL_REVIEW_2026_06_16.md",
   "lines": "47",
   "quote": "B is the only one to flag that live course is 100% MCQ while MAP is >30% tech-enhanced",
   "verified": "script"
  },
  {
   "source": "grade3-reading",
   "path": "artifacts/g5_build_2026_07_02/approval_clean.md",
   "lines": "321",
   "quote": "so a rise isn't format-practice inflation.",
   "verified": "script"
  },
  {
   "source": "grade3-reading",
   "path": "_archive/2026-08-13-consolidation/top-level-docs/HANDOFF_3_KEY_ISSUES.md",
   "lines": "25",
   "quote": "MAP-equiv forms hot-text-heavy vs real MAP's MCQ mix",
   "verified": "script"
  },
  {
   "source": "g9",
   "path": "sources/Readventure - Lesson Design and Scaffolding - Updated.docx",
   "lines": "59",
   "quote": "the line range goes from \"5-8\" to \"5 through 8\", which is how the released tests write it",
   "verified": "script"
  },
  {
   "source": "grade3-reading",
   "path": "ti-courseplans/courses/map-proxy-assessment/validity/00_BRAINLIFT.md",
   "lines": "55",
   "quote": "Interface novelty is construct-irrelevant variance (AERA/APA/NCME Standard 1.13).",
   "verified": "script"
  },
  {
   "source": "grade3-reading",
   "path": "_archive/2026-08-13-consolidation/apush-corpus-hardening-20260731-tip.tar.gz",
   "member": "apush/docs/BRAINLIFT.md",
   "lines": "301-302",
   "quote": "If all SAQs become sourced, students need repeated instruction in reading different source modalities under short-answer timing.",
   "verified": "script"
  },
  {
   "source": "grade3-reading",
   "path": "ti-courseplans/courses/map-proxy-assessment/validity/00_CASE_FOR_APPROVAL.md",
   "lines": "183",
   "quote": "format familiarity is measurement hygiene, not test prep",
   "verified": "script"
  },
  {
   "source": "grade3-reading",
   "path": "ti-courseplans/courses/map-proxy-assessment/validity/MAP_PROXY_VALIDITY_CASE.md",
   "lines": "105",
   "quote": "One scope note on format familiarization: the benefit is strongest for the three formats confirmed in Reading 2–5 specifically (MCQ, multi-select, EBSR/composite); the other three are low-harm additional practice, not a claimed MAP-preparation benefit.",
   "verified": "script"
  }
 ],
 "citations": [
  {
   "ref": "AERA, APA & NCME 2014, Standards for Educational and Psychological Testing",
   "url": "https://www.testingstandards.net/open-access-files.html"
  }
 ],
 "found_in": [
  "2026-10-12-4-deep-sweep",
  "2026-10-12-5-full-crawl"
 ],
 "added": "2026-10-12",
 "updated": "2026-10-13"
}
