{
 "id": "keep-the-text-still-as-teaching-appears",
 "title": "Keep the text still as teaching appears",
 "statement": "Keep the passage still while teaching appears around it, reserving the space from the start, because text that shifts when modelling begins is jarring.",
 "group": "the-text",
 "role": "criterion",
 "facets": [
  "stimulus",
  "demand"
 ],
 "stage": null,
 "scope": "universal",
 "domains": [
  "g3"
 ],
 "kind": "adopted-rule",
 "status": "held",
 "detail": "A review of a Grade 3 reading build said that when the modelling starts and the text shifts left, it is jarring. The rebuild reserves the space the teaching will use from the beginning of the lesson, so the text never moves out from under the child. A later course standard accepts a student-facing checkpoint only when its layout remains stable as content is revealed, and lists layout shift among its failure signals.",
 "against": "none found",
 "evidence": [
  {
   "source": "grade3-reading-review-hub",
   "path": "course-packages/archive/g3-reading-v4/FEEDBACK-RESPONSES.md",
   "lines": "206",
   "quote": "when the modeling starts and the text shifts left, it's jarring.",
   "verified": "script"
  },
  {
   "source": "grade3-reading-review-hub",
   "path": "course-packages/archive/g3-reading-v4/FEEDBACK-RESPONSES.md",
   "lines": "212-213",
   "quote": "the space the teaching will use is reserved from the beginning of the lesson, so the text never moves out from under the child.",
   "verified": "script"
  },
  {
   "source": "grade3-reading-review-hub",
   "path": "course-packages/quality/golden-student-course/versions/1.0.0/STANDARD.qmd",
   "lines": "298",
   "quote": "layout remains stable as content is revealed.",
   "verified": "script"
  },
  {
   "source": "grade3-reading-review-hub",
   "path": "course-packages/quality/golden-student-course/versions/1.0.0/STANDARD.qmd",
   "lines": "299",
   "quote": "Failure signals: Dense diagnostic panels; multiple primary actions; long passive blocks; layout shift; decorative complexity.",
   "verified": "script"
  }
 ],
 "citations": [],
 "found_in": [
  "2026-10-12-5-full-crawl"
 ],
 "added": "2026-10-13"
}
