{
 "id": "measure-a-conversation-by-turns-and-uptake",
 "title": "Measure a conversation by turns and uptake",
 "statement": "Measure a comprehension conversation by the turns it runs, how much language the learner produces and whether each reply used the learner's answer, not by responses per minute alone.",
 "example": "One blueprint treats about five turns as the shape of a comprehension conversation.",
 "group": "making-and-reviewing",
 "role": "method",
 "facets": [
  "measurement",
  "evidence-of-learning"
 ],
 "stage": "measure",
 "scope": "universal",
 "domains": [
  "g3",
  "research"
 ],
 "kind": "adopted-rule",
 "status": "held",
 "detail": "The opportunities-to-respond BrainLift's blueprint measures with three signals, not one: responses per minute, turns per conversation and how much language the child produces, along with whether the app actually used the child's answer (`othello-course-renderer-draft/repo/docs/pedagogy/otr-brainlift-2026-07-24.md`, line 106). Following the Strive-for-Five model it treats about five turns as the shape of a comprehension conversation (line 84), and a reply that would read the same whatever the child answered is not a third turn (line 86). Which measures to build, and how to capture young children's spoken answers well enough to score them, it leaves open (line 192).",
 "against": "The BrainLift was written for PreK to Grade 2 and calls itself out of scope for grades 3 and above; the Grade 3 course that adopted it treats its age-band specifics as context only (the same file, line 12).",
 "evidence": [
  {
   "source": "course-renderer-draft",
   "path": "repo/docs/pedagogy/otr-brainlift-2026-07-24.md",
   "lines": "106",
   "quote": "Measure with three signals, not one: responses per minute, turns per conversation, and how much language the child produces, along with whether the app actually used the child’s answer.",
   "verified": "script"
  },
  {
   "source": "course-renderer-draft",
   "path": "repo/docs/pedagogy/otr-brainlift-2026-07-24.md",
   "lines": "84",
   "quote": "the app should treat about five turns as the shape of a comprehension conversation",
   "verified": "script"
  },
  {
   "source": "course-renderer-draft",
   "path": "repo/docs/pedagogy/otr-brainlift-2026-07-24.md",
   "lines": "86",
   "quote": "A reply that would read the same no matter what the child answered is not a third turn.",
   "verified": "script"
  },
  {
   "source": "course-renderer-draft",
   "path": "repo/docs/pedagogy/otr-brainlift-2026-07-24.md",
   "lines": "192",
   "quote": "The open questions to work through are which of these measures to build into the app, and how to capture a young child’s spoken responses reliably enough to score them.",
   "verified": "script"
  }
 ],
 "citations": [
  {
   "ref": "Cabell & Zucker 2024, Using Strive-for-Five conversations to strengthen language comprehension in preschool through Grade One, The Reading Teacher",
   "url": "https://doi.org/10.1002/trtr.2266"
  }
 ],
 "found_in": [
  "2026-10-12-5-full-crawl"
 ],
 "added": "2026-10-13"
}
