{
 "id": "no-live-self-view-while-learning",
 "title": "No live self-view while learning",
 "statement": "Keep a live view of the learner's own face out of a lesson, because seeing oneself can raise appearance anxiety and lower recall.",
 "example": "Across 3 experiments with university students, self-view raised appearance anxiety, and that anxiety lowered lecture recall.",
 "group": "how-people-learn",
 "role": "criterion",
 "facets": [
  "media"
 ],
 "stage": null,
 "scope": "universal",
 "domains": [
  "g9",
  "research"
 ],
 "kind": "external-research",
 "status": "contested",
 "detail": "The Grade 9 idea research reports a peer-reviewed paper of 3 experiments with 171, 124 and 224 university students in which camera-on with self-view raised social appearance anxiety most, and that anxiety, not camera status itself, mediated lower lecture recall. It concludes that an audio-only lesson with no camera removes this failure mode rather than designing around it.",
 "against": "The study's sample was university students, so applying it to 14- and 15-year-olds is an inference; and a 2021 study by Austin, Fogler and Daniel reports in its title that seeing self and others on screen does not negatively impact learning in virtual classrooms (https://doi.org/10.1037/stl0000303).",
 "evidence": [
  {
   "source": "grade3-reading",
   "path": "knowledge_bot/knowledge/kb-0249-g9-idea-research-full-files.qmd",
   "lines": "96-97",
   "quote": "3 experiments, 171/124/224 university students. Camera-on with self-view raised social appearance anxiety most; that anxiety, not camera status itself, mediated lower lecture recall.",
   "verified": "script"
  },
  {
   "source": "grade3-reading",
   "path": "knowledge_bot/knowledge/kb-0249-g9-idea-research-full-files.qmd",
   "lines": "98",
   "quote": "(university sample; generalization to 14–15s is inferential)",
   "verified": "script"
  },
  {
   "source": "grade3-reading",
   "path": "knowledge_bot/knowledge/kb-0249-g9-idea-research-full-files.qmd",
   "lines": "144-145",
   "quote": "An audio-only, no-camera format structurally removes this failure mode rather than needing to design around it.",
   "verified": "script"
  }
 ],
 "citations": [
  {
   "ref": "Tien, Imundo & Bjork 2023, Viewing oneself during synchronous online learning increases appearance anxiety and decreases memory for lecture content, Applied Cognitive Psychology",
   "url": "https://doi.org/10.1002/acp.4048"
  },
  {
   "ref": "Austin, Fogler & Daniel 2021, Seeing self and others on-screen does not negatively impact learning in virtual classrooms, Scholarship of Teaching and Learning in Psychology",
   "url": "https://doi.org/10.1037/stl0000303"
  }
 ],
 "found_in": [
  "2026-10-12-4-deep-sweep"
 ],
 "added": "2026-10-12"
}
