{
 "id": "praise-the-process-never-the-person",
 "title": "Praise the process, never the person",
 "statement": "Praise and encouragement name the specific process or strategy the learner used, never the person, stay truthful and never slip in the answer.",
 "group": "what-a-student-is-told",
 "role": "criterion",
 "facets": [
  "feedback",
  "wording"
 ],
 "stage": null,
 "scope": "universal",
 "domains": [
  "g3",
  "g9"
 ],
 "kind": "adopted-rule",
 "status": "contested",
 "detail": "The grade-3 rulebook's register with the child says to praise the process, never the person, never to praise effort on something easy, and never to make points or praise the reason to read. A reading quality canon asks that uptake name the strategy the child used, as in 'I like how you used what you know about lions to decide…', praising the process, not the answer.",
 "against": "A grade 9 lesson engine gives every line a student reads one plain voice with no praise at all (the record one-plain-voice-for-every-line), so whether a line may praise differs between courses; the two fit only when the encouragement names an effort or strategy rather than praising. Untested with students.",
 "evidence": [
  {
   "source": "grade3-reading",
   "path": "artifacts/judgment-corpus/distilled-src/03-INSTRUCTION-DESIGN.md",
   "lines": "246-247",
   "quote": "Praise the PROCESS, never the person; never praise effort on something easy.",
   "verified": "script"
  },
  {
   "source": "grade3-reading",
   "path": "artifacts/judgment-corpus/distilled-src/03-INSTRUCTION-DESIGN.md",
   "lines": "248-249",
   "quote": "The reason to read stays inside the text — points and praise are never the reason.",
   "verified": "script"
  },
  {
   "source": "grade3-reading",
   "path": "artifacts/u4l2-build/g5-audit/P2-RULESET.md",
   "lines": "457",
   "quote": "Uptake names the strategy the child used ('I like how you used what you know about lions to decide…'), praising the process not the answer.",
   "verified": "script"
  },
  {
   "source": "g9",
   "path": "transcript/chat-transcript.redacted.txt",
   "lines": "4332",
   "quote": "Motivator: encourage a specific useful effort or strategy, without giving away the answer.",
   "verified": "script"
  },
  {
   "source": "g9",
   "path": "transcript/chat-transcript.redacted.txt",
   "lines": "3097",
   "quote": "The Motivator supports persistence through specific, truthful encouragement without quietly supplying the interpretation.",
   "verified": "script"
  },
  {
   "source": "g9",
   "path": "transcript/chat-transcript.redacted.txt",
   "lines": "2866",
   "quote": "Helps students re-engage without doing the reasoning for them. Encouragement should remain truthful and age-appropriate.",
   "verified": "script"
  }
 ],
 "citations": [],
 "found_in": [
  "2026-10-12-5-full-crawl"
 ],
 "added": "2026-10-13",
 "updated": "2026-10-13"
}
