{
 "id": "name-the-right-part-ask-for-the-rest",
 "title": "Name the right part, ask for the rest",
 "statement": "When an answer is partly right, say which part is right and ask only for the missing part.",
 "group": "what-a-student-is-told",
 "role": "criterion",
 "facets": [
  "feedback",
  "hints"
 ],
 "stage": null,
 "scope": "universal",
 "domains": [
  "g3",
  "research"
 ],
 "kind": "adopted-rule",
 "status": "held",
 "detail": "A built Grade 3 lesson's feedback on a half-answer to a two-part question names the part the child gave and asks only for the missing one. A research-based conversation table for early reading makes the same move on a partly right answer: it confirms the part that is right, points to where to look, and asks what is missing.",
 "against": "none found",
 "evidence": [
  {
   "source": "downloads",
   "path": "SUPERSEDED — see v2 (table format)_ WITW Lesson 1 learning walkthrough.md",
   "lines": "311",
   "quote": "Feedback on a half-answer names the part the child *did* give and asks only for the missing one.",
   "verified": "script"
  },
  {
   "source": "downloads",
   "path": "WF - Brainlift Opportunities to - 260724-110911.md",
   "lines": "100",
   "quote": "“The snow is part of it. Look at her hands in the picture. What is missing?”",
   "verified": "script"
  },
  {
   "source": "g9",
   "path": "transformer/src/glue/threejs-archivist.js",
   "lines": "208",
   "quote": "Secure only when all four hold; a job is called missing only on a confident no. One next step, ours.",
   "verified": "script"
  },
  {
   "source": "g9",
   "path": "transformer/src/glue/threejs-archivist.js",
   "lines": "232",
   "quote": "const nextJob = verdict === \"developing\" ? NEED.find((j) => met[j] === false) ?? \"\" : \"\";",
   "verified": "script"
  },
  {
   "source": "g9",
   "path": "transformer/v02/QA.md",
   "lines": "99-100",
   "quote": "It is now a Jev choice among four authored steps, filled with the student's own words, and shown only when Jev is sure.",
   "verified": "script"
  },
  {
   "source": "g9",
   "path": "transformer/v02/QA.md",
   "lines": "102",
   "quote": "a paragraph doing all three got no step (0.26 s).",
   "verified": "script"
  },
  {
   "source": "g9",
   "path": "transformer/src/glue/threejs-archivist.js",
   "lines": "240",
   "quote": "Zoom in on a second word from the quotation and say what it adds.",
   "verified": "script"
  },
  {
   "source": "g9",
   "path": "transformer/src/mechanics/open-check.js",
   "lines": "116-117",
   "quote": "const k = vs.findIndex((x) => x === \"fails\"); return missed(`${vs.includes(\"holds\") ? \"Part of it is there. \" : \"\"}${item.criteria[k].nudge}`);",
   "verified": "script"
  },
  {
   "source": "g9",
   "path": "transformer/src/glue/animated.js",
   "lines": "68",
   "quote": "lines: { ...lines, partial: \"Part of it is there.\", ...own }",
   "verified": "script"
  },
  {
   "source": "grade3-reading",
   "path": "_archive/2026-08-13-consolidation/codex-history-extract/CODEX-HISTORY-EVERYTHING-OUT.md",
   "lines": "79-80",
   "quote": "grader must never demand \"say more\" of a correct answer without saying what more.",
   "verified": "script"
  },
  {
   "source": "g9",
   "path": "transcript/chat-transcript.redacted.txt",
   "lines": "4362",
   "quote": "When given a partial answer about Iago pretending loyalty, the Archivist acknowledged the idea and asked who the performance was directed toward and why, rather than supplying the answer.",
   "verified": "script"
  },
  {
   "source": "othello-archive",
   "path": "server/api.mjs",
   "lines": "96",
   "quote": "partial: reply names what is right, then ONE question or line pointer that narrows toward what is missing. Never give the missing idea itself.",
   "verified": "script"
  }
 ],
 "citations": [
  {
   "ref": "Zucker et al. 2020",
   "url": "https://doi.org/10.1002/trtr.1943"
  }
 ],
 "found_in": [
  "2026-10-12-4-deep-sweep",
  "2026-10-12-5-full-crawl",
  "2026-10-12-6-transformer-ideas"
 ],
 "added": "2026-10-12",
 "updated": "2026-10-13"
}
