{
 "id": "how-much-of-a-lesson-is-review",
 "title": "How much of a lesson is review",
 "statement": "How much of a lesson should be review, and whether that share should change with the lesson's place in a unit, is unsettled.",
 "example": "One course's documents give about 70:30 review to new for middle lessons, about 70:30 new to review, and about 90:10 review to new.",
 "group": "not-settled",
 "role": "context",
 "facets": [
  "sequence",
  "practice"
 ],
 "stage": null,
 "scope": "universal",
 "domains": [
  "g3"
 ],
 "kind": "open-question",
 "status": "open",
 "detail": "A Grade 4 reading course's generation contract replaced a literal 90:10 review budget with a banded one: middle lessons about 70:30 review to new, openers about 50:50 because little has been taught, and synthesis or transfer lessons about 90:10. The same course's pedagogy notes and foundations document say about 70:30 new to review, and its sequencing brief sets within-unit spacing at about 90% review and 10% new across interleaved tracks, as does a Grade 1 plan. The documents agree that review runs in tracks beside the new material and differ on the share, and nothing measured which share helps learners.",
 "against": "none found",
 "evidence": [
  {
   "source": "grade3-reading",
   "path": "ti-courseplans/courses/g4-reading/approval-package/generation-contract.md",
   "lines": "85",
   "quote": "Review budget (banded, not literal 90:10)",
   "verified": "script"
  },
  {
   "source": "grade3-reading",
   "path": "ti-courseplans/courses/g4-reading/approval-package/generation-contract.md",
   "lines": "86-87",
   "quote": "Middle lessons ~70:30 (review:new); openers/BUILD ~50:50 (little prior; say so); synthesis/transfer ~90:10.",
   "verified": "script"
  },
  {
   "source": "grade3-reading",
   "path": "ti-courseplans/courses/g4-reading/approval-package/generation-contract.md",
   "lines": "87-88",
   "quote": "Show a \"today's budget\" line and name the review tracks.",
   "verified": "script"
  },
  {
   "source": "grade3-reading",
   "path": "ti-courseplans/courses/g4-reading/showcase-lessons/docs/PEDAGOGY.md",
   "lines": "171",
   "quote": "Reviewed material keeps returning inside new lessons (~70:30 new:review, DI track",
   "verified": "script"
  },
  {
   "source": "grade3-reading",
   "path": "ti-courseplans/courses/g4-reading/approval-package/foundations.md",
   "lines": "30",
   "quote": "Review is budgeted into every lesson (~70:30 new-to-review), mastery is re-tested after a delay,",
   "verified": "script"
  },
  {
   "source": "grade3-reading",
   "path": "ti-courseplans/courses/g4-reading/approval-package/SEQUENCING-BRIEF.md",
   "lines": "117",
   "quote": "**Within-unit spacing** per the DI track model (~90% review / 10% new across interleaved tracks).",
   "verified": "script"
  },
  {
   "source": "grade3-reading",
   "path": "ti-courseplans/courses/g1-reading/brainlifts/v0.1.md",
   "lines": "180-181",
   "quote": "**Track-design lesson composition** — ~90% review / 10% new across 4–6 interleaved tracks (ability-adjusted)",
   "verified": "script"
  }
 ],
 "citations": [],
 "found_in": [
  "2026-10-12-5-full-crawl"
 ],
 "added": "2026-10-13"
}
